<?xml version="1.1" encoding="UTF-8"?>


<!DOCTYPE edicts SYSTEM "ashoka_edicts.dtd">
<edicts>
    <head>
        <source>text</source>
        <place>text</place>
    </head>
    <content>
        <sentence>
            <number>a</number>
            <text>text</text>
        </sentence>
    </content>
</edicts>